,goods_id,class1,class2,topic,teacher
1314,14055,财经课程,私人银行,高净值人士投资工具运用的四种逻辑,刘宁辉
1312,14056,财经课程,私人银行,面向高净值人士的投资工具选择,刘宁辉
392,11761,财经课程,私人银行,国美股权之争背后的故事,卢晓慧
594,11763,财经课程,私人银行,股权激励的关键要素,卢晓慧
336,11764,财经课程,私人银行,股权激励模式之逻辑思维与得到,卢晓慧
184,11765,财经课程,私人银行,股权激励模式之华为与美的,卢晓慧
269,11766,财经课程,私人银行,股权激励的案例分析,卢晓慧
1272,14017,财经课程,私人银行,腾讯收购搜狗，意欲何为？,卢晓慧
1274,14018,财经课程,私人银行,并购重组概述,卢晓慧
1267,14019,财经课程,私人银行,并购重组案例分析,卢晓慧
1279,14020,财经课程,私人银行,并购重组概述与案例分析,卢晓慧
161,11814,财经课程,私人银行,私人银行客户经理必备,古致平
508,11063,财经课程,私人银行,第二届私人银行大赛命题逻辑解读,宋健
402,10875,财经课程,私人银行,GRAT信托及其在特朗普家族财富传承当中的运用,屠卫
29,11696,财经课程,私人银行,信息透明时代的信托设计,屠卫
696,11697,财经课程,私人银行,离岸信托保密体系的塌陷（下）,屠卫
172,11698,财经课程,私人银行,离岸信托保密体系的塌陷（中）,屠卫
752,11699,财经课程,私人银行,离岸信托保密体系的塌陷（上）,屠卫
598,11700,财经课程,私人银行,离岸信托保密体系,屠卫
366,11701,财经课程,私人银行,引言——“藏富”于离岸信托,屠卫
550,11702,财经课程,私人银行,离岸信托的信息透明化挑战,屠卫
883,12579,财经课程,私人银行,什么是数字资产,屠卫
884,12580,财经课程,私人银行,数字资产传承的障碍,屠卫
887,12581,财经课程,私人银行,数字资产清单的建立,屠卫
886,12582,财经课程,私人银行,数字资产传承的处置方式,屠卫
885,12583,财经课程,私人银行,数字资产传承的人员安排,屠卫
882,12584,财经课程,私人银行,数字资产的继承流程,屠卫
888,12585,财经课程,私人银行,个人数字资产的传承安排,屠卫
943,12734,财经课程,私人银行,从“真功夫”看民营企业的“花架子”,席啸
942,12736,财经课程,私人银行,初创企业的股权架构缺陷和“真功夫”的发展历史,席啸
939,12737,财经课程,私人银行,分红权、隐私保护、避免公私不分的设计方法和思路,席啸
938,12738,财经课程,私人银行,合作伙伴选择、退出机制、股权分配、公司决策权的设计思路,席啸
937,12739,财经课程,私人银行,家族企业的隐藏风险和家族企业的治理,席啸
941,12740,财经课程,私人银行,民营企业的公司类型选择和公司章程的价值,席啸
940,12741,财经课程,私人银行,真功夫的股权之争特点和公司架构的改变,席啸
1079,13710,财经课程,私人银行,家族信托基础知识分享,强胜楠
1083,13711,财经课程,私人银行,离岸家族信托实务操作,强胜楠
1081,13712,财经课程,私人银行,国内家族信托实务操作,强胜楠
1082,13713,财经课程,私人银行,美国家族信托实务操作,强胜楠
1080,13714,财经课程,私人银行,家族信托业务实务操作,强胜楠
969,12867,财经课程,私人银行,新设公司的五大架构考量,徐登峰
972,12868,财经课程,私人银行,如何区分公司类型,徐登峰
973,12869,财经课程,私人银行,企业类型的多样与经营期限,徐登峰
971,12870,财经课程,私人银行,投资主体的选择,徐登峰
970,12871,财经课程,私人银行,股份代持的恩怨及三类股东,徐登峰
372,11311,财经课程,私人银行,为什么要规划大额保单,曾祥霞
780,11313,财经课程,私人银行,大额保单与债务隔离,曾祥霞
41,11315,财经课程,私人银行,大额保单与婚姻财富规划（上）,曾祥霞
351,11317,财经课程,私人银行,大额保单与婚姻财富规划（下）,曾祥霞
667,11319,财经课程,私人银行,大额保单与财富传承综合应用案例,曾祥霞
975,12872,财经课程,私人银行,家族企业股权传承的危机与应对,李可书
981,12873,财经课程,私人银行,家族企业传承常见四大风险,李可书
978,12874,财经课程,私人银行,家族企业传承七大工具（上）,李可书
977,12875,财经课程,私人银行,家族企业传承七大工具（下）,李可书
974,12876,财经课程,私人银行,家族企业传承体系十四个方面,李可书
825,11926,财经课程,私人银行,美国篇——平衡投资，优化资产配置,杨晔
826,11928,财经课程,私人银行,加拿大篇——各类相关资产配置,杨晔
827,12089,财经课程,私人银行,带你了解美国的资本市场,杨晔
828,12090,财经课程,私人银行,美国篇——房产、保险相关资产配置,杨晔
829,12091,财经课程,私人银行,美加身份高净值人士的资产配置,杨晔
673,10813,财经课程,私人银行,家族信托实操难点,杨颂雅
686,11838,财经课程,私人银行,资产代持五大风险,桂芳芳
456,11839,财经课程,私人银行,资产代持法商四计和巧用工具,桂芳芳
62,11840,财经课程,私人银行,巧用代持实现高效营销,桂芳芳
664,11841,财经课程,私人银行,资产代持法商四计 实现保单高效营销,桂芳芳
197,11842,财经课程,私人银行,资产代持三大优势,桂芳芳
1014,13118,财经课程,私人银行,源起：中国式信托风雨40年,赵力
1011,13119,财经课程,私人银行,家族艺术财富管理风险的应变之道,赵力
1012,13120,财经课程,私人银行,洛克菲勒家族：“六代帝国”的艺术财富传承秘密,赵力
1018,13121,财经课程,私人银行,“吝啬鬼”盖蒂的艺术人生,赵力
1017,13122,财经课程,私人银行,优雅传承的奥秘：家族艺术财富管理,赵力
77,11588,财经课程,私人银行,家族办公室的运作模式,陈海燕
81,11589,财经课程,私人银行,如何建立家族办公室的商业方案流程,陈海燕
302,11590,财经课程,私人银行,家族企业的核心金融服务,陈海燕
725,11591,财经课程,私人银行,家族企业的核心增值服务,陈海燕
663,11592,财经课程,私人银行,如何打造家族企业的财富传承,陈海燕
1072,13700,财经课程,私人银行,如何打造卓越的客户体验，从CRM到CVM,陈海燕
1074,13701,财经课程,私人银行,卓越客户关系管理的工具和体系,陈海燕
1070,13702,财经课程,私人银行,财富管理的差异化经营和深度服务,陈海燕
1071,13703,财经课程,私人银行,新业态下私人银行家的场景革命,陈海燕
1073,13704,财经课程,私人银行,如何长期维护宝藏高端客户,陈海燕
1051,13578,财经课程,私人银行,高净值人群为何需要家族办公室,颜怀江
1050,13579,财经课程,私人银行,中国式家族办公室的服务体系长什么样,颜怀江
1049,13580,财经课程,私人银行,机构型家族办公室如何实现本土化落地,颜怀江
1056,13581,财经课程,私人银行,机构内如何开展家办业务,颜怀江
60,11870,财经课程,私人银行,高净值人士在想什么,魏绍玲
195,11368,财经课程,税务解读,存贷双高的风险警示,其他
1256,14002,财经课程,税务解读,三大自贸区税收优惠新政对比分析,夏倩
1250,14003,财经课程,税务解读,海南自由贸易港建设总体方案精髓解读,夏倩
1255,14004,财经课程,税务解读,海南自贸区税收新政详解,夏倩
1249,14005,财经课程,税务解读,自贸区投资切勿陷入税筹陷阱,夏倩
1260,14006,财经课程,税务解读,海南自贸区新政解读及税筹案例分析,夏倩
1096,13727,财经课程,税务解读,高净值人士面临的税收环境与挑战,彭启蕾
1095,13728,财经课程,税务解读,反避税规则相继出台,彭启蕾
1091,13729,财经课程,税务解读,反避税领域的基本认知与经典模式,彭启蕾
1094,13730,财经课程,税务解读,反避税经典案例解析,彭启蕾
1099,13731,财经课程,税务解读,高净值人士税筹六大建议,彭启蕾
1098,13732,财经课程,税务解读,高净值人士反避税风险与案例解析,彭启蕾
374,10981,财经课程,税务解读,避税港的前世今生,李经纬
313,11061,财经课程,税务解读,信息透明时代的风险与挑战,李经纬
1115,13745,财经课程,税务解读,财富基石构成与税务信息交换,李经纬
1112,13746,财经课程,税务解读,五种全球税务信息交换渠道,李经纬
1108,13747,财经课程,税务解读,新时代的风险与应对,李经纬
1110,13748,财经课程,税务解读,信息透明时代的风险与挑战,李经纬
1128,13766,财经课程,税务解读,避税港的产生,李经纬
1130,13767,财经课程,税务解读,选择避税港的动机,李经纬
1126,13768,财经课程,税务解读,避税港的影响,李经纬
1129,13769,财经课程,税务解读,避税港的前世今生,李经纬
294,11883,财经课程,税务解读,个人节税之道及未来展望,柴文祺
100,11884,财经课程,税务解读,企业节税之企业所得税思路与案例,柴文祺
518,11885,财经课程,税务解读,企业节税之增值税思路与案例,柴文祺
326,11886,财经课程,税务解读,中国最新税收环境介绍,柴文祺
353,11887,财经课程,税务解读,税收大数据下，企业与个人的节税实操,柴文祺
600,10411,财经课程,税务解读,CRS国际协定来了，中国人的海外资产该如何应对?,王亭喜
684,11275,财经课程,税务解读,居民和非居民个人薪酬所得的筹划,翟继光
157,11277,财经课程,税务解读,共同适用的薪酬所得筹划,翟继光
10,11279,财经课程,税务解读,个人其他综合所得及个人其他所得的筹划,翟继光
707,11280,财经课程,税务解读,新个税法下的纳税筹划,翟继光
79,11350,财经课程,税务解读,个人所得税汇算清缴的概念和重要性,邢娟
370,11352,财经课程,税务解读,“个人所得税汇算清缴”的实务解析,邢娟
276,11353,财经课程,税务解读,年终奖的陷阱以及案例解析,邢娟
710,11354,财经课程,税务解读,个人所得税汇算清缴，你准备好了吗,邢娟
131,11522,财经课程,税务解读,大数据时代税筹新思路概述,邢娟
593,11523,财经课程,税务解读,组织架构税筹——顶层持股架构,邢娟
607,11524,财经课程,税务解读,组织架构税筹——成立分公司还是子公司,邢娟
715,11525,财经课程,税务解读,组织架构税筹——出资形式与并购重组,邢娟
658,11526,财经课程,税务解读,商业模式税筹,邢娟
342,11527,财经课程,税务解读,合同设计税筹,邢娟
190,11528,财经课程,税务解读,优惠政策税筹,邢娟
425,11529,财经课程,税务解读,大数据时代企业税筹新思路模型,邢娟
539,11598,财经课程,税务解读,金三系统原理和管“票”的手段,邢娟
543,11599,财经课程,税务解读,金三系统管“税”的方法,邢娟
581,11600,财经课程,税务解读,金三系统下的税务风险管控原理,邢娟
640,11894,财经课程,税务解读,税务筹划一点通 2.0,邢娟
356,11569,财经课程,税务解读,战“疫”，税收纾困政策----防护救治与物资供应,闫俊
66,11570,财经课程,税务解读,战“疫”，税收纾困政策----公益捐赠与中小微企业,闫俊
265,11571,财经课程,税务解读,渡“劫”复“工”----社保解难和综合扶助政策,闫俊
267,11572,财经课程,税务解读,中小企业抗“疫”渡“劫”——税费纾困扶助政策解读,闫俊
824,11301,财经课程,税务解读,个人捐赠如何在个税前扣除,闫淑青
468,11371,财经课程,税务解读,税收常识：美国税收居民个人的判定,闫淑青
289,11372,财经课程,税务解读,税收常识：香港税收居民个人的判定,闫淑青
778,11819,财经课程,税务解读,节税概述与节税基本思路,闫淑青
85,11821,财经课程,税务解读,增值税的常见节税方法,闫淑青
537,11822,财经课程,税务解读,企业所得税的常见节税方法,闫淑青
252,11823,财经课程,税务解读,企业所得税和其他税种的常见节税方法,闫淑青
311,11824,财经课程,税务解读,节税失败的常见问题,闫淑青
572,11825,财经课程,税务解读,中小企业节税策略,闫淑青
894,12586,财经课程,税务解读,我们为什么要减税,闫淑青
893,12587,财经课程,税务解读,我国减税空间的影响因素分析（上）,闫淑青
895,12588,财经课程,税务解读,我国减税空间的影响因素分析（下）,闫淑青
898,12589,财经课程,税务解读,如何有效使用我国的减税空间,闫淑青
890,12590,财经课程,税务解读,我国减税空间还有多大,闫淑青
906,12703,财经课程,税务解读,中国税收洼地系列-海南会成为下一个国际避税地吗？,闫淑青
1026,13229,财经课程,税务解读,个人所得税法改革内容解读,闫淑青
1029,13330,财经课程,税务解读,新个税法对不同人群的税收影响（上）,闫淑青
1027,13331,财经课程,税务解读,新个税法对不同人群的税收影响（下）,闫淑青
1028,13332,财经课程,税务解读,境内高收入人士的税收安排策略（上）,闫淑青
1023,13333,财经课程,税务解读,境内高收入人士的税收安排策略（下）,闫淑青
1024,13334,财经课程,税务解读,“走出去”高收入人士的税收安排策略,闫淑青
1030,13335,财经课程,税务解读,新个税法下高收入人士的税务规划,闫淑青
1327,14191,财经课程,职业素养,经典案例解析及营销技巧,任瑾
1321,14192,财经课程,职业素养,实战演练怎样做有效,任瑾
1325,14193,财经课程,职业素养,投资顾问实战演练及经典案例解析,任瑾
1326,14194,财经课程,职业素养,投顾服务规范与考核评价工作流程指引,任瑾
431,11593,财经课程,职业素养,调查的理论与实践,何建新
714,11594,财经课程,职业素养,二手数据的搜集与分析,何建新
669,11595,财经课程,职业素养,定性调查的解读与应用,何建新
231,11596,财经课程,职业素养,定量调查的解读与应用,何建新
590,11597,财经课程,职业素养,通过“调查”挖掘客户背后的真实需求,何建新
34,10219,财经课程,职业素养,商务会议礼仪,其他
814,10221,财经课程,职业素养,有趣的职场心理效应,其他
207,10222,财经课程,职业素养,寻找职场幸福感,其他
705,10243,财经课程,职业素养,客户开发技巧系列之三：如何更好的留住客户？,其他
87,10245,财经课程,职业素养,客户开发技巧系列之二：如何练就沟通的魅力？,其他
93,10306,财经课程,职业素养,商务用餐礼仪,其他
335,10551,财经课程,职业素养,职场情商训练,其他
730,10555,财经课程,职业素养,时间都去哪了,其他
584,10597,财经课程,职业素养,销售谈判专家,其他
900,12600,财经课程,职业素养,破译社交密码-实战商务礼仪,其他
533,11376,财经课程,职业素养,理财经理如何提升个人的吸引力,冷超
376,11377,财经课程,职业素养,构建关系网，圈子营销,冷超
622,11378,财经课程,职业素养,如何与客户迅速建立关系,冷超
544,11379,财经课程,职业素养,客户关系的业务维护和情感维护,冷超
477,11380,财经课程,职业素养,客户分层与分类维护及经营关系的四大策略,冷超
490,11381,财经课程,职业素养,客户关系的建立与维护,冷超
409,11388,财经课程,职业素养,电话邀约前的准备及话术包装,冷超
514,11389,财经课程,职业素养,电话邀约异议处理,冷超
118,11390,财经课程,职业素养,电话邀约六步法,冷超
248,11391,财经课程,职业素养,电话邀约结束后如何跟进,冷超
229,11392,财经课程,职业素养,电话邀约实战技巧,冷超
932,12730,财经课程,职业素养,职场妆容着装的重要性,刁东燕
933,12731,财经课程,职业素养,色彩与着装搭配,刁东燕
936,12732,财经课程,职业素养,如何选择适合自己的发型,刁东燕
934,12733,财经课程,职业素养,日常化妆的流程及方法,刁东燕
935,12735,财经课程,职业素养,职场妆容修饰技巧,刁东燕
1077,13706,财经课程,职业素养,执行力的重要性和态度,刁东燕
1078,13707,财经课程,职业素养,个人执行力的提升,刁东燕
1076,13708,财经课程,职业素养,组织的执行力提升,刁东燕
1075,13709,财经课程,职业素养,高效执行力,刁东燕
1317,14186,财经课程,职业素养,重塑营销思维-用故事思维重新思考,姚楠
1318,14187,财经课程,职业素养,打造精品故事-用经历打磨营销故事,姚楠
1316,14188,财经课程,职业素养,拓宽营销思路-故事营销模式与锦囊,姚楠
1315,14189,财经课程,职业素养,讲好营销故事-有情有理优化客户体验,姚楠
1319,14190,财经课程,职业素养,讲故事卖金融产品,姚楠
699,11767,财经课程,职业素养,数字化线上获客营销和模式创新,孙素丹
643,11768,财经课程,职业素养,打破传统思维，高效扩大线上客户池,孙素丹
196,11769,财经课程,职业素养,数字化线上营销之微信获客,孙素丹
30,11770,财经课程,职业素养,线上获客营销工具分享,孙素丹
626,11771,财经课程,职业素养,数字化线上获客营销升级与模式创新,孙素丹
1041,13346,财经课程,职业素养,皮肤的解析,宋琳梅
1040,13347,财经课程,职业素养,问题肌肤的管理,宋琳梅
1043,13348,财经课程,职业素养,医美项目对比,宋琳梅
1042,13349,财经课程,职业素养,皮肤管理与医美,宋琳梅
201,11382,财经课程,职业素养,全方位认识焦虑,常颖
495,11383,财经课程,职业素养,焦虑是如何产生,常颖
255,11384,财经课程,职业素养,焦虑和目标合理设定,常颖
117,11385,财经课程,职业素养,采取行动，克服负面情绪,常颖
398,11386,财经课程,职业素养,焦虑的释放,常颖
280,11862,财经课程,职业素养,认清短视频平台,张飛
661,11863,财经课程,职业素养,成功案例分析及如何做好短视频,张飛
164,11864,财经课程,职业素养,教你营销内容植入，直播引流及抖音算法解读,张飛
230,11865,财经课程,职业素养,掘金短视频，经典答疑汇总,张飛
393,11866,财经课程,职业素养,理财从业者掘金短视频和直播,张飛
847,12319,财经课程,职业素养,销售系列课2.0,张飛
1224,13971,财经课程,职业素养,中国茶的起源与分类（上）,朱锦武
1214,13972,财经课程,职业素养,中国茶的起源与分类（下）,朱锦武
1217,13973,财经课程,职业素养,中国茶的起源与分类,朱锦武
1244,13974,财经课程,职业素养,一杯茶养成沉稳气质——茶道黄金四法则,朱锦武
1059,13694,财经课程,职业素养,葡萄酒的大千世界,李斯伟
1060,13695,财经课程,职业素养,葡萄酒的高级鉴赏,李斯伟
1064,13696,财经课程,职业素养,葡萄酒高级鉴赏,李斯伟
1161,13915,财经课程,职业素养,让思维看的见,李爱华
1158,13916,财经课程,职业素养,让表达更清晰,李爱华
1164,13917,财经课程,职业素养,让绘图成习惯,李爱华
1172,13918,财经课程,职业素养,让应用更有趣,李爱华
1171,13919,财经课程,职业素养,思维导图：让思维看的见，让应用更有趣,李爱华
1277,14021,财经课程,职业素养,决定表达效果的要素是什么,李爱华
1271,14022,财经课程,职业素养,如何做一个具有结构化思维的高手,李爱华
1269,14023,财经课程,职业素养,如何对要素进行分类,李爱华
1270,14024,财经课程,职业素养,如何呈现神奇的表达,李爱华
1280,14025,财经课程,职业素养,结构化思维与表达,李爱华
944,12742,财经课程,职业素养,微表情识别技术及应对策略,杜夏阳
946,12743,财经课程,职业素养,微表情到底是什么,杜夏阳
947,12744,财经课程,职业素养,微表情应对策略,杜夏阳
945,12745,财经课程,职业素养,微表情表达了什么,杜夏阳
1198,13941,财经课程,职业素养,投诉情境下的客户沟通技巧,杜夏阳
1201,13942,财经课程,职业素养,投诉情境下客户以及员工的内在心理机制,杜夏阳
1196,13943,财经课程,职业素养,投诉的研究现状及心理学基础知识,杜夏阳
1204,13944,财经课程,职业素养,客户投诉处理及员工自我关怀,杜夏阳
35,11607,财经课程,职业素养,销售系列课,杨宁昱 CoCo
729,10609,财经课程,职业素养,决胜理财师大赛-案例篇,林鸿钧
931,12725,财经课程,职业素养,影响他人的三种心理状态,王新宇
928,12726,财经课程,职业素养,高接受度状态的四种带入技巧,王新宇
930,12727,财经课程,职业素养,高接受度和中等接受度状态的典型沟通场景与销售中的应用,王新宇
927,12728,财经课程,职业素养,低接受度状态的典型沟通场景与销售中的应用,王新宇
929,12729,财经课程,职业素养,销售技巧之抓住客户心理,王新宇
1199,13945,财经课程,职业素养,如何在销售中判断对方的底线（上）,王新宇
1202,13946,财经课程,职业素养,如何在销售中判断对方的底线（中）,王新宇
1194,13947,财经课程,职业素养,如何在销售中判断对方的底线（下）,王新宇
1205,13948,财经课程,职业素养,如何在销售中判断对方的底线,王新宇
1063,13697,财经课程,职业素养,赛事和赛车介绍,王萌
1069,13698,财经课程,职业素养,赛车安全,王萌
1068,13699,财经课程,职业素养,“速度与激情”，走进赛车,王萌
677,11650,财经课程,职业素养,情绪管理系列课,秦红
445,11832,财经课程,职业素养,情商决定命运——塑造20年后的孩子,苏卫宏
154,11833,财经课程,职业素养,智商、情商、财商解析,苏卫宏
709,11834,财经课程,职业素养,看是情商实是财商：案例分析,苏卫宏
567,11835,财经课程,职业素养,财商如何驱动情商,苏卫宏
478,11836,财经课程,职业素养,用财商驱动情商—塑造20年后的孩子,苏卫宏
1152,13909,财经课程,职业素养,电话邀约流程与实操要点,苏黎
1151,13910,财经课程,职业素养,电话邀约实战话术与案例精讲,苏黎
1155,13911,财经课程,职业素养,客户有效面谈的前期准备与资产检视技巧,苏黎
1156,13912,财经课程,职业素养,客户资产配置解决方案设计与呈现,苏黎
1154,13913,财经课程,职业素养,营销活动组织与案例解析,苏黎
857,12443,财经课程,职业素养,钻石选购“避坑”指南,薛岩
854,12444,财经课程,职业素养,钻石的4C标准及证书解读,薛岩
853,12445,财经课程,职业素养,钻石的肉眼鉴定方法,薛岩
855,12446,财经课程,职业素养,解密莫桑钻由来及和钻石的区别,薛岩
856,12447,财经课程,职业素养,钻石鉴赏与选购,薛岩
1173,13757,财经课程,职业素养,到底什么是KYC？,薛飞
1165,13758,财经课程,职业素养,一切问题都可以追溯到KYC,薛飞
1160,13759,财经课程,职业素养,KYC是设计出来的,薛飞
1166,13760,财经课程,职业素养,让KYC信息落地生根,薛飞
1167,13761,财经课程,职业素养,设计KYC脚本，深入挖掘客户需求,薛飞
990,12889,财经课程,职业素养,奔涌的艺术“后浪”——艺术银行,赵力
988,12890,财经课程,职业素养,物质精神的双重回报——艺术品资产,赵力
987,12891,财经课程,职业素养,珠联璧合——艺术银行的公益性与艺术性,赵力
992,12892,财经课程,职业素养,万亿产业链诞生——艺术银行的商业发展之路,赵力
991,12893,财经课程,职业素养,助推艺术“后浪”——多重领域全面开花,赵力
1186,13937,财经课程,职业素养,用户画像及其构建方法,郎巧妹
1192,13938,财经课程,职业素养,赋能客户画像进行产品设计,郎巧妹
1187,13939,财经课程,职业素养,高价值客户金融产品设计,郎巧妹
1191,13940,财经课程,职业素养,客户画像与产品优化,郎巧妹
1300,14043,财经课程,职业素养,营销习惯与客户选择四要素,郑奕
1299,14044,财经课程,职业素养,基于客户导向的需求分析与挖掘,郑奕
1308,14045,财经课程,职业素养,通过售后服务赢得客户的心,郑奕
1302,14046,财经课程,职业素养,以客户为导向的营销智慧,郑奕
1232,13982,财经课程,职业素养,商务会议礼仪,靳斓
1235,13983,财经课程,职业素养,商务用餐礼仪,靳斓
983,12882,财经课程,职业素养,高效沟通技巧,马琳
986,12884,财经课程,职业素养,沟通从同理心开始,马琳
982,12885,财经课程,职业素养,高效沟通的基础：认识自己、理解他人,马琳
985,12886,财经课程,职业素养,高效沟通技巧：学会倾听,马琳
984,12888,财经课程,职业素养,高效沟通技巧：赞赏式激励、有力发问及自我修炼,马琳
687,10507,财经课程,财经人文,一杯茶养成沉稳气质——茶道黄金四法则,其他
23,10509,财经课程,财经人文,中国茶起源与分类,其他
214,10591,财经课程,财经人文,玉成锦绣-翡翠有情,其他
651,10595,财经课程,财经人文,咖啡文化,其他
527,11778,财经课程,财经人文,谁才是你值得信赖的财务管家,其他
627,11779,财经课程,财经人文,做好财务计划是省钱的第一步,其他
273,11780,财经课程,财经人文,实现金融服务的几种手段,其他
541,11781,财经课程,财经人文,承受风险的能力与回报息息相关,其他
540,11782,财经课程,财经人文,夫妻理财观念不同，如何做好共同服务,其他
872,12566,财经课程,财经人文,从历史的视角看庚子年,天晓得（王建）
