,goods_id,class1,class2,topic,teacher
457,10629,财经课程,宏观经济,中国货币政策工具的影响与走势,其他
1297,14048,财经课程,宏观经济,2020第十三届中国金融理财师年会 持证人圆桌论坛及闭幕,其他
1292,14050,财经课程,宏观经济,我国宏观经济运行与货币政策趋向,其他
579,11235,财经课程,宏观经济,2020经济与资本市场展望（一）国内稳发展，风险要防范,刘国庆
246,11237,财经课程,宏观经济,2020经济与资本市场展望（二）分析世界局势，提出机遇与挑战,刘国庆
404,11239,财经课程,宏观经济,2020经济与资本市场展望（三）5G大背景下的投资风口,刘国庆
757,11241,财经课程,宏观经济,2020经济与资本市场展望（四）预测2020投资十大风口行业,刘国庆
390,11299,财经课程,宏观经济,2020经济与资本市场展望,刘国庆
1123,13770,财经课程,宏观经济,行为经济学视角下的财富管理,刘宁辉
1125,13771,财经课程,宏观经济,行为经济学对财富管理的影响、应用与行业展望,刘宁辉
1131,13772,财经课程,宏观经济,客户视角和专业视角看资产配置,刘宁辉
1127,13773,财经课程,宏观经济,资产配置的CMS模型,刘宁辉
1124,13774,财经课程,宏观经济,行为经济学视角下的资产配置,刘宁辉
1036,13339,财经课程,宏观经济,如何理解货币政策与经济的关联？,刘雪莹
1037,13340,财经课程,宏观经济,央行大水漫灌的货币政策工具有哪些？,刘雪莹
1039,13341,财经课程,宏观经济,央行精准滴灌的货币政策工具有哪些？,刘雪莹
1038,13342,财经课程,宏观经济,平衡大水漫灌与精准滴灌的艺术,刘雪莹
1033,13343,财经课程,宏观经济,货币政策效果及未来走向如何？,刘雪莹
1034,13344,财经课程,宏观经济,大水漫灌与精准滴灌,刘雪莹
1159,13920,财经课程,宏观经济,宏观经济的基础框架及主要数据（上）,夏天然
1174,13921,财经课程,宏观经济,宏观经济的基础框架及主要数据（下）,夏天然
1175,13922,财经课程,宏观经济,宏观经济中国的信贷指标和流动性指标,夏天然
1162,13923,财经课程,宏观经济,宏观经济中的物价指标、经济政策与周期,夏天然
1176,13924,财经课程,宏观经济,宏观经济角度下的大类资产配置,夏天然
1179,13925,财经课程,宏观经济,读懂经济指标-宏观经济分析逻辑,夏天然
1294,14052,财经课程,宏观经济,财富面临的巨大叠加风险与挑战,宋健
183,11412,财经课程,宏观经济,金融危机怎么发生的？,屈庆
602,11413,财经课程,宏观经济,美国宏观经济指标体系介绍,屈庆
403,11414,财经课程,宏观经济,美国行业经济指标体系介绍,屈庆
804,11415,财经课程,宏观经济,欧洲和日本经济指标体系介绍,屈庆
387,11416,财经课程,宏观经济,中国宏观经济数据您读懂了吗---宏观经济指标初探和分析的原则,屈庆
272,11417,财经课程,宏观经济,中国宏观经济数据您读懂了吗---经济的三架马车是什么？,屈庆
139,11418,财经课程,宏观经济,中国宏观经济数据您读懂了吗---老百姓如何保证钱不贬值,屈庆
72,11419,财经课程,宏观经济,中国宏观经济数据您读懂了吗---房地产等行业如何影响宏观经济,屈庆
121,11420,财经课程,宏观经济,宏观经济指标及数据解读,屈庆
1295,14049,财经课程,宏观经济,疫情留痕：周期与结构,彭文生
959,12853,财经课程,宏观经济,中美关系及贸易战的回顾、本质与展望,彭波
957,12854,财经课程,宏观经济,美国的地缘、外交理论与战略,彭波
956,12855,财经课程,宏观经济,美国的贸易保护主义，中美关系及文明,彭波
955,12856,财经课程,宏观经济,中美贸易战的回顾与启示,彭波
958,12857,财经课程,宏观经济,中美共治下的世界及我们的选择,彭波
1293,14051,财经课程,宏观经济,《2020中国金融理财人才素质报告》发布会,李经纬
694,11328,财经课程,宏观经济,一切监管政策本源--习总书记金融相关讲话解读与分析（上）,王刚
126,11329,财经课程,宏观经济,一切监管政策本源--习总书记金融相关讲话解读与分析（下）,王刚
722,11330,财经课程,宏观经济,央行、银保监会年度工作会议解读及政策分析（上）,王刚
463,11331,财经课程,宏观经济,央行、银保监会年度工作会议解读及政策分析（下）,王刚
701,11332,财经课程,宏观经济,贷款定价机制、信贷结构、民营小微企业金融监管政策梳理,王刚
308,11333,财经课程,宏观经济,资管新规配套细则解读（上）,王刚
620,11334,财经课程,宏观经济,资管新规配套细则解读（下）,王刚
277,11336,财经课程,宏观经济,疫情对宏观经济、银行业的影响及应对政策解读,王刚
737,11337,财经课程,宏观经济,金融监管部门政策解读及政策走向研判,王刚
227,11338,财经课程,宏观经济,金融（监管）政策解读,王刚
388,11208,财经课程,宏观经济,以美元为主的世界货币体系是如何形成的？,翟进
1025,13228,财经课程,宏观经济,2020年下半年大类资产配置策略,聂俊峰
343,10861,财经课程,宏观经济,中美贸易战分析及对汇率市场的影响,邵传华
630,11777,财经课程,宏观经济,货币金融指标入门分析,郎达群
1296,14047,财经课程,宏观经济,数字时代的中美关系,阎学通
711,11111,财经课程,宏观经济,还原印度经济奇迹背后的秘密（上）,阿图尔•乔什
122,11137,财经课程,宏观经济,对话惠誉Fitch Ratings前CEO,阿图尔•乔什
1048,13350,财经课程,宏观经济,2020年政治经济金融冲击及经济结构调整对银行业的影响,陈择华
1046,13351,财经课程,宏观经济,无经济增速目标与“六保”“六稳”下银行业如何行动,陈择华
1044,13452,财经课程,宏观经济,2020年主要行业趋势及银行降本增效创新策略,陈择华
1047,13453,财经课程,宏观经济,消费迭代与利率调整后的银行业务策略,陈择华
1045,13454,财经课程,宏观经济,2020年两会与宏观经济分析与对策,陈择华
296,11676,财经课程,宏观经济,全国两会,雷振妹
496,11677,财经课程,宏观经济,国内三大经济会议,雷振妹
624,11678,财经课程,宏观经济,全球两大议息会议,雷振妹
27,11679,财经课程,宏观经济,你需要知道的国内外六大经济会议,雷振妹
1089,13715,财经课程,宏观经济,货币超发背景下的理财策略,马晓青
631,10859,财经课程,投资分析,全球石油供需格局及原油价格分析,佘建跃
839,12311,财经课程,投资分析,起航新蓝海，揭开REITs神秘面纱,倪康加
840,12312,财经课程,投资分析,美国、亚洲REITs市场现状全面解析,倪康加
841,12313,财经课程,投资分析,中国REITs的演变之路,倪康加
842,12314,财经课程,投资分析,REITs的投资之道,倪康加
843,12315,财经课程,投资分析,全维度解析中国版公募REITs,倪康加
509,10581,财经课程,投资分析,2020 分析和评估客户当前的财务状况,其他
878,12571,财经课程,投资分析,如何从零开始完成一个ABS项目,其他
1262,14016,财经课程,投资分析,融资融券交易规则入门,其他
1258,14007,财经课程,投资分析,资产配置的“聚”与“散”,刘宁辉
1253,14008,财经课程,投资分析,资产配置的“舍”与“得”,刘宁辉
1254,14009,财经课程,投资分析,财富机遇背后的逻辑闭环（上）,刘宁辉
1248,14010,财经课程,投资分析,财富机遇背后的逻辑闭环（下）,刘宁辉
1261,14011,财经课程,投资分析,资产配置的舍与得,刘宁辉
703,10903,财经课程,投资分析,债券投资分析之利率债,刘恋
459,10965,财经课程,投资分析,从美债收益率曲线倒挂谈资产配置,刘恋
755,11059,财经课程,投资分析,大股东的另类减持,刘恋
591,11211,财经课程,投资分析,减持规定引众议，中外条款大不同,刘恋
418,11632,财经课程,投资分析,历次疫情对经济的影响,刘恋
301,11633,财经课程,投资分析,本次疫情对经济的影响,刘恋
770,11634,财经课程,投资分析,本次疫情对行业的影响,刘恋
241,11635,财经课程,投资分析,本次疫情对投资者心理的影响,刘恋
25,11636,财经课程,投资分析,疫情如何影响人们的投资决策和投资心理,刘恋
270,11749,财经课程,投资分析,前言：市场需要择时吗？市场能够择时吗？什么是市场底部？,刘恋
211,11750,财经课程,投资分析,境内股票市场底部估值指标判断（一）,刘恋
82,11751,财经课程,投资分析,境内股票市场底部估值指标判断（二）,刘恋
0,11752,财经课程,投资分析,境内股票市场底部情绪指标判断,刘恋
73,11753,财经课程,投资分析,境内股票市场底部宏观环境判断以及当前市场状况判断总结,刘恋
71,11754,财经课程,投资分析,境内股票市场底部特征,刘恋
88,11900,财经课程,投资分析,基于估值指标和情绪指标的投资策略,刘恋
179,11902,财经课程,投资分析,估值指标与情绪指标（一）,刘恋
758,11904,财经课程,投资分析,如何取得指数超额收益？——基于市场指标的择时策略,刘恋
436,11953,财经课程,投资分析,估值指标与情绪指标（二）,刘恋
226,11954,财经课程,投资分析,量化择时投资交易,刘恋
1150,13904,财经课程,投资分析,黄金的锚是什么,刘恋
1149,13905,财经课程,投资分析,几轮“放水”下的黄金价格,刘恋
1148,13906,财经课程,投资分析,未来黄金投资的机会与产品选择,刘恋
1147,13907,财经课程,投资分析,黄金的投资逻辑及趋势,刘恋
879,12570,财经课程,投资分析,银行投资理财产品相关风险,刘钟鸣
880,12573,财经课程,投资分析,私募投资基金的特点与合规运营,刘钟鸣
876,12574,财经课程,投资分析,答疑：销售合规、风险责任、借条规范等,刘钟鸣
877,12576,财经课程,投资分析,私募投资基金与第三方理财产品风险,刘钟鸣
891,12577,财经课程,投资分析,选择不同理财产品需要注意的法律问题,刘钟鸣
820,11083,财经课程,投资分析,负利率（二） ——负利率债券值得投资吗？,刘雪莹
260,11210,财经课程,投资分析,负利率（三）——存贷款市场负利率,刘雪莹
83,11871,财经课程,投资分析,负利率（四）——负利率的传导路径和影响,刘雪莹
779,11430,财经课程,投资分析,科技公司为啥对AB股“情有独钟”,卢晓慧
364,11432,财经课程,投资分析,权力的游戏AB股,卢晓慧
585,11462,财经课程,投资分析,阿里巴巴与港交所的“未了情缘”,卢晓慧
578,11463,财经课程,投资分析,AB股的“直线”和“曲线”,卢晓慧
156,11475,财经课程,投资分析,上市公司的各种“雷”,卢晓慧
124,11476,财经课程,投资分析,价值识别的财务指标之毛利率、扣非净利润、ROE,卢晓慧
245,11477,财经课程,投资分析,价值识别的财务指标之经营性现金流、关联交易,卢晓慧
464,11478,财经课程,投资分析,价值识别的非财务指标,卢晓慧
430,11479,财经课程,投资分析,暴雷的深层原因及应对策略,卢晓慧
732,11480,财经课程,投资分析,练就企业价值识别的“火眼金睛”- 财务指标&非财务指标,卢晓慧
453,11530,财经课程,投资分析,哈佛分析的框架,卢晓慧
563,11531,财经课程,投资分析,战略分析,卢晓慧
679,11532,财经课程,投资分析,会计分析,卢晓慧
322,11533,财经课程,投资分析,财务分析（上）,卢晓慧
605,11534,财经课程,投资分析,财务分析（中）,卢晓慧
401,11535,财经课程,投资分析,财务分析（下）,卢晓慧
54,11536,财经课程,投资分析,前景分析,卢晓慧
314,11537,财经课程,投资分析,价值投资与分析逻辑,卢晓慧
55,11538,财经课程,投资分析,哈佛分析与价值投资,卢晓慧
1212,13966,财经课程,投资分析,买方投顾业务的中国实践,吴清扬
1219,13967,财经课程,投资分析,买方投顾创造的用户价值探讨（上）,吴清扬
1227,13968,财经课程,投资分析,买方投顾创造的用户价值探讨（下）,吴清扬
1213,13969,财经课程,投资分析,买方投顾的现状与未来,吴清扬
1223,13970,财经课程,投资分析,买方投顾业务的探索与实践,吴清扬
218,11583,财经课程,投资分析,指数投资的意义,周佳蓉
806,11585,财经课程,投资分析,被动指数型基金,周佳蓉
416,11586,财经课程,投资分析,普通股票型基金,周佳蓉
158,11587,财经课程,投资分析,股票型基金的投资分析,周佳蓉
74,11601,财经课程,投资分析,市场投资者情绪研究的意义,周佳蓉
96,11602,财经课程,投资分析,情绪性指标对市场走势的影响（上）,周佳蓉
764,11603,财经课程,投资分析,情绪性指标对市场走势的影响（下）,周佳蓉
7,11605,财经课程,投资分析,情绪性指数的交易策略分析,周佳蓉
225,11606,财经课程,投资分析,A股情绪性指标的构建和交易策略分析,周佳蓉
142,11615,财经课程,投资分析,什么是对冲基金？（上）,周佳蓉
568,11616,财经课程,投资分析,什么是对冲基金？（下）,周佳蓉
766,11617,财经课程,投资分析,对冲基金策略的量化分析（上）,周佳蓉
784,11618,财经课程,投资分析,对冲基金策略的量化分析（下）,周佳蓉
482,11619,财经课程,投资分析,对冲基金的投资分析,周佳蓉
892,12591,财经课程,投资分析,基金经理投资能力对产品业绩影响（上）,周佳蓉
899,12592,财经课程,投资分析,基金经理投资能力对产品业绩影响（下）,周佳蓉
896,12593,财经课程,投资分析,基金经理投资能力定性定量分析（上）,周佳蓉
889,12594,财经课程,投资分析,基金经理投资能力定性定量分析（下）,周佳蓉
897,12595,财经课程,投资分析,公募股票基金经理投资能力分析,周佳蓉
979,12877,财经课程,投资分析,带期权特征的理财产品分析,周佳蓉
976,12878,财经课程,投资分析,带期权特征的理财产品实例,周佳蓉
980,12879,财经课程,投资分析,期权特征对理财产品的影响,周佳蓉
999,12995,财经课程,投资分析,什么是量化交易,周佳蓉
993,12996,财经课程,投资分析,量化交易对市场的影响（上）,周佳蓉
1007,12997,财经课程,投资分析,量化交易对市场的影响（下）,周佳蓉
1009,12998,财经课程,投资分析,量化交易对交易的改变（上）,周佳蓉
1010,12999,财经课程,投资分析,量化交易对交易的改变（下）,周佳蓉
1008,13000,财经课程,投资分析,量化交易改变交易本身,周佳蓉
400,11868,财经课程,投资分析,投资组合提升课2.0,夏天然
919,12713,财经课程,投资分析,企业财务报表操纵的常用手法及预警信号,孙希荣
916,12714,财经课程,投资分析,总体识别财务报表操纵的几种方法,孙希荣
920,12715,财经课程,投资分析,对资产负债表项目操纵的识别,孙希荣
918,12716,财经课程,投资分析,对利润表项目操纵的识别,孙希荣
915,12717,财经课程,投资分析,对现金流量表项目操纵的识别,孙希荣
917,12718,财经课程,投资分析,证监会稽查IPO财务舞弊的方法,孙希荣
921,12719,财经课程,投资分析,财务报表操纵与识别,孙希荣
451,11091,财经课程,投资分析,全球衰退下的资产配置（一）深度剖析全球经济形势,宋健
111,11093,财经课程,投资分析,全球衰退下的资产配置（二）新形势下大类资产配置,宋健
587,11663,财经课程,投资分析,资深客户经理必备系列课,宋玉臣
1142,13782,财经课程,投资分析,股票投机智慧,宋玉臣
1136,13783,财经课程,投资分析,人性决定股性,宋玉臣
1138,13784,财经课程,投资分析,股市为啥只有少数人赚钱,宋玉臣
1135,13896,财经课程,投资分析,如何看待技术分析,宋玉臣
1145,13897,财经课程,投资分析,基本分析为何更有难度,宋玉臣
1133,13898,财经课程,投资分析,被动投资的主动策略,宋玉臣
1137,13899,财经课程,投资分析,我的股票投机经历与体会,宋玉臣
1132,13900,财经课程,投资分析,认识中国股市,宋玉臣
1143,13901,财经课程,投资分析,中国股市为何牛短熊长,宋玉臣
1139,13902,财经课程,投资分析,中国股市的奇葩事件,宋玉臣
1141,13903,财经课程,投资分析,中国股市的未来：注册制时代,宋玉臣
756,11251,财经课程,投资分析,突发事件（一）概念和特点,屈庆
136,11253,财经课程,投资分析,突发事件（二）本轮疫情和非典对市场影响的比较和分析,屈庆
554,11255,财经课程,投资分析,突发事件（三）如何影响中国经济和金融市场,屈庆
395,11257,财经课程,投资分析,突发事件（四）经济和金融市场如何应对,屈庆
8,11271,财经课程,投资分析,突发事件下经济和金融市场如何应对,屈庆
660,11846,财经课程,投资分析,资管新规下，泛资管行业何去何从？,屈庆
467,11852,财经课程,投资分析,公募，信托，券商，保险理财发展现状,屈庆
531,11853,财经课程,投资分析,资管行业的前世今生,屈庆
206,11854,财经课程,投资分析,资管行业和资管产品的前世今生,屈庆
1301,14064,财经课程,投资分析,债券市场基本情况,屈庆
1310,14065,财经课程,投资分析,债券投资基本逻辑与案例解析,屈庆
1304,14066,财经课程,投资分析,固定收益类资产配置基本逻辑和案例,屈庆
286,10853,财经课程,投资分析,资管新规下的信托产品投资策略,屠卫
433,11826,财经课程,投资分析,国企混改与格力的股份转让事件,席啸
380,11827,财经课程,投资分析,格力电器发展史和格力电器架构改变,席啸
638,11828,财经课程,投资分析,格力电器的控制人和珠海明骏的股权架构,席啸
621,11829,财经课程,投资分析,董明珠在董事会和股东大会的影响力和对格力电器的控制力,席啸
487,11830,财经课程,投资分析,董明珠在格力电器混改事件中带给我们的启示与借鉴,席啸
167,11831,财经课程,投资分析,从董明珠看另类公司控制--来自“格力电器”的经验,席啸
99,11073,财经课程,投资分析,常颖的奢侈品鉴赏逻辑（一）奢侈品的历史与自我品牌风格,常颖
551,11075,财经课程,投资分析,常颖的奢侈品鉴赏逻辑（二）练就自己的奢侈品购买技巧,常颖
181,10793,财经课程,投资分析,玩转 ETF,张兴
597,10893,财经课程,投资分析,股票投资策略：自上而下与自下而上,张兴
819,11197,财经课程,投资分析,科创板投资正当时（一）科创板全景,张兴
668,11199,财经课程,投资分析,科创板投资正当时（二）科创板定价及交易特征,张兴
266,11201,财经课程,投资分析,科创板投资正当时（三）如何参与科创板,张兴
234,11300,财经课程,投资分析,科创板投资正当时,张兴
610,11363,财经课程,投资分析,新《证券法》修订背景,张兴
582,11364,财经课程,投资分析,新《证券法》的五大突破之全面推行注册制,张兴
50,11365,财经课程,投资分析,新《证券法》的五大突破之全四项加强改革,张兴
817,11366,财经课程,投资分析,新《证券法》的影响及市场点评与投资机会,张兴
26,11367,财经课程,投资分析,新《证券法》：注册制时代，激活资本市场活力,张兴
101,11576,财经课程,投资分析,您需要了解的投资人心理特征——过度自信,张泽迅
639,11577,财经课程,投资分析,您需要了解的投资人心理特征——心理账户,张泽迅
120,11651,财经课程,投资分析,全球主要股市估值现状,张泽迅
769,11652,财经课程,投资分析,全球主要股市间估值比较及港股投资价值分析,张泽迅
697,11653,财经课程,投资分析,全球主要股市估值比较,张泽迅
174,11755,财经课程,投资分析,您需要了解的投资人心理特征——损失厌恶,张泽迅
300,11756,财经课程,投资分析,您需要了解的投资人心理特征——羊群效应,张泽迅
405,11757,财经课程,投资分析,您需要了解的投资人心理特征,张泽迅
913,12708,财经课程,投资分析,原油供需关系和油价影响因素,张泽迅
912,12709,财经课程,投资分析,油价的历史、现状和未来,张泽迅
910,12710,财经课程,投资分析,油价暴跌对金融投资工具以及上游行业的影响,张泽迅
911,12711,财经课程,投资分析,油价暴跌对中下游行业的影响及投资建议,张泽迅
914,12712,财经课程,投资分析,油价暴跌带来的投资机会,张泽迅
6,10627,财经课程,投资分析,中国陶瓷收藏与投资,张现峰
744,11494,财经课程,投资分析,陶瓷的魅力与投资优点,张现峰
818,11495,财经课程,投资分析,陶瓷的购买途径分析,张现峰
774,11496,财经课程,投资分析,潜力陶瓷品种的投资分析,张现峰
327,11497,财经课程,投资分析,陶瓷艺术品如何合理购买,张现峰
57,11809,财经课程,投资分析,信托行业存在的问题与乱象（上）,张鹏
15,11810,财经课程,投资分析,信托行业存在的问题与乱象（下）,张鹏
420,11811,财经课程,投资分析,信托业的强监管格局,张鹏
767,11812,财经课程,投资分析,信托产品、人员和行业发展趋势分析,张鹏
545,11813,财经课程,投资分析,信托业发展趋势研判及分析,张鹏
753,11071,财经课程,投资分析,区块链正悄悄颠覆金融业？,戴星
516,10851,财经课程,投资分析,可转债投资入门,曹渊
996,13001,财经课程,投资分析,战胜通货膨胀的不二法门,朱晓俊
1001,13002,财经课程,投资分析,散户为何更适合做基金投资,朱晓俊
995,13003,财经课程,投资分析,给小白的第一堂基金课,朱晓俊
1000,13004,财经课程,投资分析,本金翻倍背后的秘密,朱晓俊
1003,13005,财经课程,投资分析,判断风险承受能力与基金投资偏好,朱晓俊
1004,13006,财经课程,投资分析,如何运用基金做资产配置,朱晓俊
997,13007,财经课程,投资分析,投资者为何总是买错基金,朱晓俊
994,13008,财经课程,投资分析,基金界的“新生儿”——FOF,朱晓俊
1005,13009,财经课程,投资分析,属于你的操作——择时与择基,朱晓俊
998,13010,财经课程,投资分析,远离“傲慢与偏见”，做聪明的投资者,朱晓俊
1006,13011,财经课程,投资分析,基金被套该怎么办,朱晓俊
1002,13012,财经课程,投资分析,细数买基金的那些“坑”,朱晓俊
176,11097,财经课程,投资分析,房地产市场周期与层次,李兴隆
146,11099,财经课程,投资分析,房地产市场影响因素与市场展望,李兴隆
966,12862,财经课程,投资分析,房地产市场上半年回顾及未来展望,李兴隆
1286,14036,财经课程,投资分析,经济内循环是什么,李兴隆
1289,14037,财经课程,投资分析,为什么要提出经济内循环,李兴隆
1288,14038,财经课程,投资分析,经济内循环优劣势以及对资产配置的影响,李兴隆
1287,14040,财经课程,投资分析,内循环背景下的资产配置,李兴隆
275,11454,财经课程,投资分析,债券市场实质违约概况与特征,李恺
740,11455,财经课程,投资分析,债券违约因素分析,李恺
232,11456,财经课程,投资分析,债券违约前的普遍特征,李恺
748,11457,财经课程,投资分析,违约债券回收现状、处置方式及债券市场的未来展望,李恺
377,11458,财经课程,投资分析,当前境内市场债券违约情况概述,李恺
558,11369,财经课程,投资分析,央行发行数字货币意味着什么？（中）,李经纬
685,11370,财经课程,投资分析,央行发行数字货币意味着什么？（下）,李经纬
796,11735,财经课程,投资分析,什么是另类数据,李经纬
683,11736,财经课程,投资分析,另类数据的应用案例,李经纬
505,11737,财经课程,投资分析,另类数据与经济表现,李经纬
481,11738,财经课程,投资分析,从瑞幸崩盘看另类数据的应用,李经纬
831,12192,财经课程,投资分析,气象经济与气候经济,李经纬
832,12303,财经课程,投资分析,天气风险与保险（下）,李经纬
833,12304,财经课程,投资分析,气象金融衍生品的应用,李经纬
834,12305,财经课程,投资分析,经营与投资中的天气风险管理,李经纬
844,12316,财经课程,投资分析,天气风险与保险（上）,李经纬
127,11303,财经课程,投资分析,理财产品分析的基本逻辑（上）,杜大伟
552,11305,财经课程,投资分析,理财产品分析的基本逻辑（下）,杜大伟
724,11307,财经课程,投资分析,理财产品分析的简单方法---资金流的8个节点（上）,杜大伟
315,11309,财经课程,投资分析,理财产品分析的简单方法---资金流的8个节点（下）,杜大伟
693,11335,财经课程,投资分析,看懂理财产品的一般法则,杜大伟
447,11434,财经课程,投资分析,理财产品常见讲解途径的措辞方法,杜大伟
1,11436,财经课程,投资分析,“讲清理财产品”的一般法则,杜大伟
28,11460,财经课程,投资分析,理财产品常见讲解途径的措辞逻辑,杜大伟
18,11461,财经课程,投资分析,理财产品不同讲解目的的措辞逻辑与示例,杜大伟
848,12320,财经课程,投资分析,资深客户经理必备3.0,杜大伟
618,11468,财经课程,投资分析,注册制改革中的监管与投资者权益保护(一)注册制,杨兆全
455,11469,财经课程,投资分析,注册制改革中的监管与投资者权益保护(二)证券监管实践与实务,杨兆全
